### ISSUE TITLE
NChan Redis upstream: connection failed: AUTH command failed

### ISSUE THREAD

**Issue by GrayHoax** [slact/nchan#704]
Hello, community!

In my case, defined Redis server (one node) by upstream configuration via redis url like `nchan_redis_server redis://smart:a12345678@192.168.0.50/0;` dont work. In log file I found errors:
```
2025/08/17 19:07:08 [error] 18689#0: nchan: Redis node 192.168.0.50:6379 connection failed: AUTH command failed
2025/08/17 19:07:09 [error] 18689#0: nchan: Redis upstream smartintercom_redis_server: no reachable masters
```

In my mind it looks like a wrong username or password. But redis-cli with the same params works fine. After that I try to use tcpdump and see this:
```
19:12:38.775274 IP (tos 0x0, ttl 64, id 31020, offset 0, flags [DF], proto TCP (6), length 92)
    5484899-du87318.49390 > 192.168.0.50.redis: Flags [P.], cksum 0x81db (incorrect -> 0x3ebf), seq 15:55, ack 35, win 502, options [nop,nop,TS val 3480666465 ecr 2665054312], length 40: RESP "AUTH" "smart" "a12345678"
19:12:38.775358 IP (tos 0x0, ttl 64, id 53127, offset 0, flags [DF], proto TCP (6), length 52)
    192.168.0.50.redis > 5484899-du87318.49390: Flags [.], cksum 0xf07e (correct), seq 35, ack 55, win 255, options [nop,nop,TS val 2665054312 ecr 3480666465], length 0
19:12:38.775376 IP (tos 0x0, ttl 64, id 53128, offset 0, flags [DF], proto TCP (6), length 57)
    192.168.0.50.redis > 5484899-du87318.49390: Flags [P.], cksum 0x7015 (correct), seq 35:40, ack 55, win 255, options [nop,nop,TS val 2665054312 ecr 3480666465], length 5: RESP "OK"
19:12:38.775393 IP (tos 0x0, ttl 64, id 41195, offset 0, flags [DF], proto TCP (6), length 81)
    5484899-du87318.49392 > 192.168.0.50.redis: Flags [P.], cksum 0x81d0 (incorrect -> 0xf9ec), seq 15:44, ack 35, win 502, options [nop,nop,TS val 3480666465 ecr 2665054312], length 29: RESP "AUTH" "a12345678"
19:12:38.775474 IP (tos 0x0, ttl 64, id 32969, offset 0, flags [DF], proto TCP (6), length 52)
    192.168.0.50.redis > 5484899-du87318.49392: Flags [.], cksum 0x772e (correct), seq 35, ack 44, win 255, options [nop,nop,TS val 2665054313 ecr 3480666465], length 0
19:12:38.775556 IP (tos 0x0, ttl 64, id 32970, offset 0, flags [DF], proto TCP (6), length 116)
    192.168.0.50.redis > 5484899-du87318.49392: Flags [P.], cksum 0x7574 (correct), seq 35:99, ack 44, win 255, options [nop,nop,TS val 2665054313 ecr 3480666465], length 64: RESP "WRONGPASS invalid username-password pair or user is disabled."
```

I dont understand why NChan successfully authorized by "AUTH" "smart" "a12345678" (Redis accept username and password - RESP "OK"), but after that try to authorize only by password (RESP "AUTH" "a12345678") and of course got WRONGPASS response.

Both methods of config authorization (by redis url and e.g. nchan_redis_username) working wrong. Please help with problem.

NChan version 1.3.6
Nginx version 1.25.2
Redis version 6.2.5
